"recommender","recommendation","author","type","subtype","language_comment","comment"
"Lorenzo Mejino","Primal",NA,"TV Series","Animación","Español","La mejor serie de animación que he visto en mi vida es Primal en HBO Max demostrando que el poder de la imagen te puede llevar  a sensaciones que no te podías imaginar. Su 2T te deja boquiabierto en cada episodio."
"Random Twitter User","Samurai Jack",NA,"TV Series","Animación","Español", NA
"Juanjo M. Jambrina","El jardín del diablo",NA,"Film","Film","Español", "La recomienda hoy Nuria Vidal en su imprescindible blog. Es una maravilla de película. Ha madurado a lo Catherine Deneuve, que podría presentarse ya a Presidenta del Mundo."
"Luis Magrinyà","Enseñar a hablar a un monstruo","José C. Valdés","Book","Essay","Español","Esta colección de marginalia de @josecvales sobre el siempre divertido a la par que misterioso y angustioso tema de LOS ORÍGENES (aquí del lenguaje, las lenguas y la escritura) es excelente, utile et dulci!"
"Random Twitter User","Harakiri","kobayashi","Film","Film","Español","Se cumplen 60 años del estreno del HARAKIRI (切腹, 1962) de Kobayashi, uno de esos films dignos del apelativo «obra maestra» y una clase magistral del uso del sonido, de los encuadres (¡cuánta violencia genera un buen encuadre!), las escalas o la dirección de actores (Nakadai).".
"Editorial Contraseña","Mientras agonizo","William Faulkner","Book","Novel","Español","Y, hablando de traslado de cadáveres y entierros, no puedo dejar de recomendar esta obra maestra de William Faulkner."
"Random Twitter User","The Rings of Power",NA,"TV Series","Fantasy","English","Watching The Rings of Power and there's no real sense of tension or plot development, nobody to root for or dislike, just lots of stuff happening to different people very slowly."
"Fausto Fernández","Imperio de violencia","Ken Annakin","Film","Film","Español","Peli (Harry Landis) del día: IMPERIO DE VIOLENCIA, un policíaco británico lleno de sombras (ladrones, chantajes, venganzas...) y muy Fritz Lang (LOS SOBORNADOS) que consolidó a su director, Ken Annakin, como uno de los grandes."
